id,name,category,price,color,description,image_url,sizes
118,Lolana Pant in Silk,Pant,690.0,Chocolate,"Voluminous and subtly sheer pleated leg pants that gather and taper at the ankle. Cut from lightweight silk crepe de chine with a fluid drape, dry texture, and dry handfeel. The pants are complete with a mini-short lining and elastic waistband and leg openings for ease of wear.",https://cdn.shopify.com/s/files/1/0667/6142/5143/files/LolanaChocolate.webp?v=1761741532,"XS,S,M,L"
119,Mom Necklace in Silver,Accessories,3600.0,Silver,"Sterling silver scroll holder and chain, inlaid with jasper, tiger eye, and lapis lazuli. A 6-carat lab-grown, pear-shaped diamond drop swings below. The hinged top opens to hold whatever you consider sacred: a mezuza scroll, a note from your kid, a joint.",https://cdn.shopify.com/s/files/1/0667/6142/5143/files/aflalo_neckl1_front-web_300938b1-0b85-442f-91ee-4efe0100bdf5.jpg?v=1757782536,Silver
120,Janes Tears Earrings in White Gold,Accessories,5900.0,White Gold,"Welcome to my gala: 16 carats total featuring two classic cuts: each ear holds 2 carat brilliant round stones at the lobe, with a 6 carat pear-shaped drop hanging down. Set in 14k white gold with minimal prongs to emphasize scale and sparkle. Available to purchase as a single earring, or as a traditional pair.",https://cdn.shopify.com/s/files/1/0667/6142/5143/files/aflalo_earr1_front-web_c73b72a6-2ffd-483b-9c31-fd39e61e5eb8.jpg?v=1757782102,"Single,Pair"
121,Racquet String in Gold,Accessories,7500.0,Gold,"A 14.4 carat line of round-cut diamonds, woven into khaki nylon cord and anchored by 14k yellow gold settings. Standard length is 7"", to be worn as a bracelet or custom ordered as an anklet. Racquet is the new tennis as far as bracelets go. Wear it with the Ida Ring and a silk gown to pick up soda from the store down the road. To view and shop in-person, visit our Soho Showroom at 56 Greene Street, FL 3. Open weekly Wed-Sun, 11-7pm. Returns or exchanges accepted within 14 days of shipment.",https://cdn.shopify.com/s/files/1/0667/6142/5143/files/aflalo_brace1_front-web.jpg?v=1763739425,Gold
122,Fishhook Earrings in Gold,Accessories,4000.0,Gold,"10 carats total of brilliant oval-cut lab-grown diamonds, set in 14k yellow gold. Suspended from refined fishhook wires, each 5 carat stone is held in a bezel setting that highlights the scale and sparkle. Best served with a canvas bucket hat. Good with wet hair and simple black sunglasses too. Available to purchase as a single earring, or as a traditional pair. To view and shop in-person, please email to schedule an appointment at our SoHo, NY Studio.",https://cdn.shopify.com/s/files/1/0667/6142/5143/files/aflalo_earr3_front-web_bc62d92f-6a7a-42bd-9fff-6fdba09ed6ba.jpg?v=1757782618,"Single,Pair"
123,Tennis Drop Earrings in Mixed Gold,Accessories,4750.0,Mixed Gold,"A 4 carat antique emerald-cut lab-grown diamond accompanied by a 1.53 carat pink pear-shaped drop, suspended from a mixed-metal setting of 14k white and rose gold. Available to purchase as a single earring, or as a pair. Not to be confused with pear. To view and shop in-person, please email to schedule an appointment at our SoHo, NY Studio.",https://cdn.shopify.com/s/files/1/0667/6142/5143/files/aflalo_earr2_front-web_616f0e35-4cd5-4bf2-a10e-db6eb10db205.jpg?v=1757782642,"Single,Pair"
124,Racquet String in White Gold,Accessories,7500.0,White Gold,"A 14 carat line of emerald-cut diamonds, woven into a set of soft rose-colored nylon cord and anchored by 14k white gold settings. Available in two lengths, to be worn as a bracelet or anklet, with or without string hanging down. Racquet string is the new tennis as far as bracelets go. Wear it with the Ripcurl Ring and a black silk gown to pick up soda from the store down the road. To view and shop in-person, visit our Soho Showroom at 56 Greene Street, FL 3. Open weekly Wed-Sun, 11-7pm. Returns or exchanges accepted within 14 days of shipment.",https://cdn.shopify.com/s/files/1/0667/6142/5143/files/aflalo_brace2_front-web_c59b1586-fa30-4a56-a3fb-9d3a1c5068b5.jpg?v=1763741013,White Gold
125,Greek Key Ring in Platinum,Accessories,7800.0,Platinum,"A 5 carat brilliant-cut round lab-grown diamond set in platinum, accented with 0.42ctw pavé stones along the basket and band. The setting features an engraved Greek key motif—an architectural detail that adds structure, symbolism, and depth to the piece. Best when worn on the pinky or middle finger. The vibe is won it at an auction. To view and shop in-person, please email to schedule an appointment at our SoHo, NY Studio.",https://cdn.shopify.com/s/files/1/0667/6142/5143/files/aflalo_ring2_front-web_f0de008d-c077-46fc-aa44-ceece6647669.jpg?v=1757782727,"1.5,2,2.5,3,3.5,4,4.5,5,5.5,6,6.5"
126,Ripcurl Ring in White Gold,Accessories,12000.0,White Gold,"An ongoing row of emerald-cut diamonds, totaling 14 carats and set in 14k white gold will wrap around your thumb or middle finger as you project a shimmering stamp of approval or conversely express disdain. Each stone is precision-set for a seamless silhouette with bold, graphic clarity. Best when styled with the racquet bracelet in Rose. Surfs up. To view and shop in-person, please email to schedule an appointment at our SoHo, NY Studio.",https://cdn.shopify.com/s/files/1/0667/6142/5143/files/aflalo_ring4_front-web_f0147560-7643-4f06-ac32-21f107b28ca0.jpg?v=1757782782,"4,4.5,5,5.5,6,6.5,7,7.5,8,8.5"
127,Ida Ring in Gold,Accessories,8000.0,Gold,"Centered on a 5.2 carat antique emerald-cut lab-grown diamond and flanked by 1.8 carats worth of trillion side stones, this ring is designed to be worn on the pinky finger while holding a tea cup to your mouth, then subtly dropping it to the floor. Set in 14k yellow gold with fine double prongs that echo the geometry of the cut, the ring is best worn with a boxy cotton shirt and drawstring pants. To view and shop in-person, please email to schedule an appointment at our SoHo, NY Studio.",https://cdn.shopify.com/s/files/1/0667/6142/5143/files/aflalo_ring1_front-web.jpg?v=1756404354,"1.5,2,2.5,3,3.5,4,4.5,5"
128,Lolana Pant in Silk,Pant,690.0,Ivory,"Voluminous and sheer pleated leg pants that gather and taper at the ankle. Cut from lightweight silk crepe de chine with a fluid drape, dry texture, and dry handfeel. The pants are complete with a mini-short lining and elastic waistband and leg openings for ease of wear.",https://cdn.shopify.com/s/files/1/0667/6142/5143/files/LolanaPantinSilk_IVORY_9452.webp?v=1761746194,"XS,S,M,L"
129,Affine Coat in Leather,Outerwear,3800.0,Black,"A collarless, A-line coat in supple Italian lambskin leather, featuring a hidden placket, princess seams, and on-seam pockets. The silhouette is accentuated by a detachable belt at the waist and mid-length hem.",https://cdn.shopify.com/s/files/1/0667/6142/5143/files/AffineCoat_Black_Front_5b471d4e-53a5-41dd-98cf-0ed5cd4e5e1a.webp?v=1761746766,"XS,S,M,L"
130,Auvira Top in Silk,Top,570.0,Ivory,"This is a halter top with a back-neck tie closure, asymmetric front, hand-draped open back, and inside-out seam detailing. Cut for a relaxed fit on the body, the heavyweight, glossy silk satin has a liquid softness that enhances the top's rich flowing lines. Abstract floral broach coming soon. Not included with this top.",https://cdn.shopify.com/s/files/1/0667/6142/5143/files/AuviraTop_Ivory_FRONT_1.webp?v=1761746228,"XS,S,M,L"
131,Sibem Dress in Silk,Dress,890.0,Ivory,"Mini scarf dress with a gathered halter neckline, generous low back, and asymmetrical hem. Finished with an adjustable spaghetti strap tie closure, and cut in heavyweight, glossy silk satin with a liquid softness that enhances the silhouette's rich flowing lines.",https://cdn.shopify.com/s/files/1/0667/6142/5143/files/SibemDressinSilk_IVORY_9582.webp?v=1761746203,"XS,S,M,L"
132,Lolana Pant in Silk,Pant,690.0,Bronze,"Voluminous and subtly sheer pleated leg pants that gather and taper at the ankle. Cut from lightweight silk crepe de chine with a fluid drape, dry texture, and dry handfeel. The pants are complete with a mini-short lining and elastic waistband and leg openings for ease of wear.",https://cdn.shopify.com/s/files/1/0667/6142/5143/files/LolanaPantinSilk_BRONZE_9455.webp?v=1761746211,"XS,S,M,L"
133,Quillan Skirt in Silk,Skirt,810.0,Black,"Ankle length silk twill skirt with a smocked waist and shirred skirt, defined by an under-layer organza poof at the seam for slightly exaggerated shape and volume.",https://cdn.shopify.com/s/files/1/0667/6142/5143/files/QuillianSkirt_BLACK_9479.webp?v=1761746219,"XS,S,M,L"
134,Brontë Jean in Rigid Denim,Denim,430.0,Shaded Obsidian,"The Brontë Jean is high-waisted with a long, perfectly flared leg and zipper fly closure. Cut in thick rigid denim, this is a tight-fitting jean crafted to lift the butt and elongate the legs all at once.",https://cdn.shopify.com/s/files/1/0667/6142/5143/files/BronteJeaninShadedObsidian_5015-083-119_0030_f3f565c6-2af4-4fa4-9f30-3387ee24fb2b.webp?v=1761776636,"24,25,26,27,28,29,30"
135,Brontë Jean in Rigid Denim,Denim,430.0,Subdued Indigo,"The Brontë Jean is high-waisted with a long, perfectly flared leg and zipper fly closure. Cut in thick rigid denim, this is a tight-fitting jean crafted to lift the butt and elongate the legs all at once.",https://cdn.shopify.com/s/files/1/0667/6142/5143/files/BronteJeaninSubduedIndigo_5015-083-117_0021_f782d95b-4e2e-4dce-af20-36ceec8c1fc2.webp?v=1761776643,"24,25,26,27,28,29,30"
136,Elara Sweater in Cashmere,Sweater,590.0,Ivory,"Medium weight cashmere sweater with a high v-neck and raglan sleeves. Designed to fit slightly oversized with a slight taper at the hem, and finished with rib detailing.",https://cdn.shopify.com/s/files/1/0667/6142/5143/files/ElaraSweater_Ivory_FRONT_1.webp?v=1761745618,"XS,S,M,L"
137,Brein Shirt in Cotton,Top,430.0,Black,"This is an oversized button-up shirt with smoke mother-of-pearl buttons at the front placket and cuffs. Made in crisp, airy, and semi-sheer cotton organza that lends a refined balance of structure and softness to the classic silhouette.",https://cdn.shopify.com/s/files/1/0667/6142/5143/files/BreinShirt_Black_Front_b7d0fb13-d1a8-4da2-a0f4-fcdb381ab782.webp?v=1761746780,"XS,S,M,L"
138,Auvira Top in Silk,Top,570.0,Black,"This is a halter top with a back-neck tie closure, asymmetric front, hand-draped open back, and inside-out seam detailing. Cut for a relaxed fit on the body, the heavyweight, glossy silk satin has a liquid softness that enhances the top's rich flowing lines.",https://cdn.shopify.com/s/files/1/0667/6142/5143/files/AuviraTop_Black_FRONT_1.webp?v=1757375661,"XS,S,M,L"
139,Orwell Jean in Rigid Denim,Denim,430.0,Marshmallow White,"The Orwell Jean is an ode to perfect-fit vintage denim. This rigid denim jean is mid-rise with a classic straight leg and 5-button fly. Wear it true to size for a fitted look throughout, creating that lifted shape of the butt. Size it up one—or daringly, two—for the optimal slouch jean.",https://cdn.shopify.com/s/files/1/0667/6142/5143/files/OrwellJeaninMarshmallowWhite_5014-084-118_0017_5df75474-ff2c-4c0b-8990-c1b843df227b.webp?v=1761776542,"24,25,26,27,28,29,30"
140,Orwell Jean in Rigid Denim,Denim,430.0,Salt Air,"The Orwell Jean is an ode to perfect-fit vintage denim. This rigid denim jean is mid-rise with a classic straight leg and 5-button fly. Wear it true to size for a fitted look throughout, creating that lifted shape of the butt. Size it up one—or daringly, two—for the optimal slouch jean.",https://cdn.shopify.com/s/files/1/0667/6142/5143/files/OrwellJeaninSaltAir_5014-083-115_0022_b75dabe3-c1d4-4cdd-86f3-ce5441c7930f.webp?v=1761776548,"24,25,26,27,28,29,30"
141,Sibem Dress in Silk,Dress,890.0,Black,"Mini scarf dress with a gathered halter neckline, generous low back, and asymmetrical hem. Finished with an adjustable spaghetti strap tie closure, and cut in ultra-lightweight Italian silk twill with a soft, fluid handfeel.",https://cdn.shopify.com/s/files/1/0667/6142/5143/files/SibemDressinSilk_BLACK_9579.webp?v=1761746239,"XS,S,M,L"
142,Cira Tank in Wool,Sweater,230.0,Ivory,"A fitted, full-length tank top with a crew neckline and subtle contouring at the chest and back for a refined, classic silhouette. Knit from semi-sheer and light-weight ribbed merino wool.",https://cdn.shopify.com/s/files/1/0667/6142/5143/files/CiraKnitTankinWool_WHITE_9548.webp?v=1761741156,"XS,S,M,L"
143,Cira Tank in Wool,Sweater,230.0,Black,"A fitted, full-length tank top with a crew neckline and subtle contouring at the chest and back for a refined, classic silhouette. Knit from semi-sheer and light-weight ribbed merino wool.",https://cdn.shopify.com/s/files/1/0667/6142/5143/files/CiraKnitTankinWool_BLACK_9551.webp?v=1761741015,"XS,S,M,L"
144,Affine Coat in Ponyhair,Outerwear,8000.0,Leopard,"A collarless, A-line coat in smooth Italian ponyhair leather, featuring a hidden placket, princess seams, and on-seam pockets. The silhouette is accentuated by a detachable belt at the waist and mid-length hem. Handcrafted in Italy.",https://cdn.shopify.com/s/files/1/0667/6142/5143/files/AffineCoat_Leopard_Front_6a5f7cf6-164a-4c57-bf6b-e27858b6dfa7.webp?v=1761746545,"XS,S,M,L"
145,E-gift Card,Gift card,100.0,100 USD,,https://cdn.shopify.com/s/files/1/0667/6142/5143/files/aflalo_gift_card.webp?v=1726750159,"100 USD,1000 USD,250 USD,500 USD,750 USD"
